discography.id,discography.song_name,discography.lyrics,discography.album
37,Disciples,"Cause I was still unsure
But it's something I'm used to
And I can tell by your face
No one's ever been rude to you
But I can tell you things
That I can't say to anyone
And you came home today
But you didn't stay very long
Now it's like the world owes you
Walking around like everybody should know you
I wanna be like we used to
But now you're worried cause that means we'd lose you
And I had no idea
What that feeling could do to you
And I could tell you changed
By the people around you
I used to take the long way
Just so I could walk past your door
I used to wait outside
But I guess I won't anymore
There's so much I wanna tell you
So much I wanna tell you",Currents
38,'Cause I'm A Man,"Like the brutal autumn sun
It dawns on me, what have I done?
Saying sorry ain't as good as saying why
But it buys me a little more time
Lost in the moment for a second time
Each fucking doubt I make, unleash a cry
I'm just pathetic, that's the reason why
In desperation, all that you can do is ask me why

Cause I'm a man, woman
Don't always think before I do
Cause I'm a man, woman
That's the only answer I've got for you
Cause I'm a man, woman
Not often proud of what I choose
I'm a human, woman
A greater force I answer to

Once again, as it takes a hold
I am aware I'm not in control
You see, I have a conscience and it's never fooled
But it's prone to be overruled
You wanna know what I always think I'm bind by
You never accept defeat or let it slide
But I have no voice if I don't speak my mind
My weakness is the source of all my pride, I'll tell you why

Cause I'm a man, woman
Don't always think before I do
Cause I'm a man, woman
That's the only answer I've got for you
Cause I'm a man, woman
I'll never be as strong as you
I'm a human, human
A greater force I answer to",Currents
39,Reality In Motion,"I'm edging closer, shivers all over
It's way too real, I'm way too sober
Usually they've got you covered all over
Lack of composure, I'm walking over
What will I do?
I never had a chance to

There's no one else around you
Not that I was waiting, vision ever fading
Heading for the deep end
Soon as I remember, baby, I surrender
I just need to breathe out
Decisions are approaching, reality in motion

Trying to be patient, I'm feeling ancient
Trying to control but the wave that I'm facing
Suppose that I didn't care anymore
Fate can decide, I can ignore
I'll just pretend that I always knew
That I had the chance to

There's no one else around you
I've done all this waiting, vision ever fading
Making such a promise
Only leads to heartache, closer to an earthquake
Talk about a [?]
Try to stay in motion

It made my heart run in circles and overflow
And I was closer than ever to letting go
It made my heart run in circles in overdrive
And I was closer than ever to feeling alive

It made my heart run in circles and overflow
And I was closer than ever to letting go
It made my heart run in circles in overdrive
And I was closer than ever to feeling alive

There's no one else around you
Not that I was waiting, vision ever fading
Heading for the deep end
Soon as I remember, baby, I surrender
I just need to breathe out
Decisions are approaching, reality in motion
Let's not think about it
Put your arms around me, I can sense you doubt me
You don't need to promise
That only leads to heartache, closer to an earthquake
Talk about a [?]
All that's left to do, all that's left to do",Currents
40,Love/Paranoia,"I may not be as honest as I ought to be now that
When the walls go up, I said it didn't worry me
But it hit me like an avalanche
No, I can just be paranoid, don't quell the desire to know
What was really going on, does it really fucking matter?
Babe is all you can ask me, okay, fair play here we go

I've heard those words before
Are you sure it was nothing
Cause it made me feel like dying inside
Never thought I was insecure, but it's pure
Didn't notice until I was in love for real
And if we're gonna cross the line
Just to find what shit's happening
If only I could reach your mind
Oh I'd be fine, I'd be normal
Now's my time, gonna do it

And suddenly I'm the phony one
The only one with a problem
True love is bringing it out of me
The worst in me, and I know now
Do you remember the time we were
The time we were by the ocean
I didn't care if it was day or night
The world was right where I wanted
Girl I'm sorry
Babe I mean it
Babe I'm sorry",Currents
41,One More Year,"Do you remember we were standing here a year ago?
Our minds were racing and time went slow
If there was trouble in the world we didn't know
If we had a care, it didn't show
But now I worry our horizon's bear nothing new
'Cause I get this feeling and maybe you get it, too
We're on a rollercoaster stuck on its loop-de-loop
'Cause what we did one day on a whim
Has slowly become all we do
I never wanted any other way to spend our lives
I know we promised we'd be doing this 'til we die
And now I fear we might
Oh, now I fear we might
But it's okay, I think there's a way
Why don't we just say one more year?
(One more year)
Not worrying if I get the right amount of sleep
(One more year)
Not caring if we do the same thing every week
(One more year)
Of living like I'm only living for me
(One more year)
Of never talking about where we're gonna be
(One more year)
One more year
Of living like the free spirit I wanna be
We got a whole year
(One more year) Fifty-two weeks
Seven days each
(One more year) Four seasons, one reason
One way, one year
(One more year)
One year, one year
From today (From today)
From today (From today)
I never wanted any other way to spend our lives
Now one of these is gonna be the last for all time
For all time
One more year
Source: Musixmatch",The Slow Rush
42,Instant Destiny,"I'm about to do something crazy
No more delayin'
No destiny is too far
We can get a home in Miami
Go and get married
Tattoo your name on my arm
This traffic doesn't seem quite as annoying
Quite alright, quite alright, sittin' here
Yes, reminiscent, I think this is different
I know this is different
Let's cause somethin' permanent
Just so we know we can
I'm about to do something crazy
No more delayin'
No destiny is too far
Did you say, ""And here comes forever""
Oh, here forever
Let go of me with open arms
We'll be lovers
Until the end of time
I see it now
I see just how you're so right
It's so clear now
I'm about to do something crazy
No more delayin'
No destiny is too far
We can get a home in Miami
Go and get married
Tattoo your name on my arm
Let's drink this magic potion
Of love and devotion
And then let's see how it goes
Source: LyricFind",The Slow Rush
43,Borderline,"Ah
Gone a little far
Gone a little far this time for somethin'
How was I to know?
How was I to know this high came rushing?
We're on the borderline
Caught between the tides of pain and rapture
Possibly a sign
I'm gonna have the strangest night on Sunday
There I go
Quite a show for a loner in L.A.
Askin' how I managed to end up in this place
And I couldn't get away
We're on the borderline
Dangerously far and all forgiven
There's gonna be a fight
Gonna be a price to pay on Monday
(If you and I get comfortable)
We're on the borderline (on the borderline)
Caught between the tides of pain and rapture
Then I saw the time (saw the time)
Watched it speedin' by like a train
Like a train
Will I be known and loved?
Is there one that I trust?
Starting to sober up
Has it been long enough?
Will I be known and loved?
Little closer, close enough
I'm a loser, loosen up
Set it free, must be tough
Will I be known and loved?
Is there one that I trust?
If there's room, room for doubt
As within, as without ya
Will I be so in love?
Gettin' closer, close enough
Shout out to what is done
R.I.P. here comes the sun
Here comes the sun
Gone a little far
Gone a little far this time with something
How could I have known?
How was I to know this life get no shame
I said, ""Come with me outside""
I need to clear my mind
This weight is crushing
Do you see the light, oh
Coming from their eyes, oh no
And I couldn't get away
We're on the borderline
Gets me every time
These close encounters
Just to know I can (just to know I can)
Once again, I am alone
Will I be known and loved?
Is there one that I trust?
Starting to sober up
Has it been long enough?
Will I be known and loved?
Little closer, close enough
I'm a loser, loosen up
Set it free, must be tough (I was fine without ya)
Will I be known and loved?
L.A. really messed me up
And it isn't cut and dry
Conversation, well I tried (I was fine without ya)
Will I be? Stay right here
Any closer, bad idea
Shout out to what is done
R.I.P. here comes the sun (I was fine without ya)
Will I be known and loved?
Is there one that I trust?
Starting to sober up
Has it been long enough?",The Slow Rush
44,Posthumous Forgiveness,"Ever since I was a small boy
No one else compared to you, no way
I always thought heroes stayed close
Whenever troubled times arose
I didn't know, ain't always how it goes
Every single word you told me
I believed without a question, always
To save all of us
You told us both to trust
But now I know you only saved yourself
Did you think I'd never know?
Never wise-up as I grow?
And you could store an ocean in the
Holes in any of the explanations that you gave
And while you still had time, you had a chance
But you decided to take all your sorry's to the grave
Did you think I'd never know?
Never wise-up as I grow?
Did you hope I'd never doubt?
Never one day work it out?
You were runnin' for cover
Doin' like any other
Fallen out with a lover
You didn't know that I suffered
What a thing to discover
If there was time to recover
One on one with each other
Just a boy and a father
What I'd give for another
Everything that I have
I wouldn't need us for long
I'd never speak of the time
That you left us alone
Me and Steve, on our own
I wanna tell you about the time
Wanna tell you about my life
Wanna play you all my songs
Learn the words, sing along
Wanna tell you about the time
I was in Abbey Road
Or the time that I had
Mick Jagger on the phone
I thought of you when he spoke
Wanna tell you about that time
Wanna tell you about my life
Wanna play you all my songs
And hear your voice sing along
I wanna say it's alright
You're just a man after all
And I know you had demons
I got some of my own
I think you passed them along
I wanna tell you about the time
Wanna tell you about my life
Wanna play you all my songs
And hear your voice sing along",The Slow Rush
45,Breathe Deeper,"If you think I couldn't hold my own, believe me, I can
Believe me, I can, believe me, I can
If ain't so awful and we're all together, I can
Believe me, I can, believe me, I can
If you think I couldn't roll with you, believe me, I can
Believe me, I can, believe me, I can
If ideally we should feel like this forever, I can
Believe me, I can, believe me, I can
seems you're coming on
Breathe a little deeper, should you need to come undone
And let those colors run
(It just so) now you're having fun
So do this and get through this, and come find me when you're done
So we can be as one
If you think I couldn't hold my own, believe me, I can
Believe me, I can, believe me, I can
If you need someone to tell you that you're special, I can
Believe me, I can, believe me, I can
If you need someone to carry on, believe me, I can
Believe me, I can, believe me, I can
If you think no one is feeling what you're feeling, I am
Believe me, I am, believe me, I am
And the groove is slow
seems you're coming on
Breathe a little deeper, should you need to come undone
And let those colors run
Now you're having fun
So do this and get through this, and come find me when you're done
So we can be as one
'Til the mornin'
'Til the mornin'
Oh
And the groove is slow
'Til the mornin'
And the groove is slow
Seems you're coming on
Breathe a little deeper, should you need to come undone
And let those colors run
Now you're having fun
So do this and get through this, and until we see the sun
You're my number one
'Til the mornin'
(It just so)
And the groove is slow
'Til the mornin'
And the groove is slow
We're both adults but we behave like children
Long as we got enough to keep on livin'
'Til the mornin'
'Til the mornin'",The Slow Rush
46,Tomorrow's Dust,"There's no use trying to relate
To that older soul
And no use trying to debate
That they've got it wrong
There's no use pining for love
When you're on your own
And no use crying outside
If nobody's home
There's no use flying to the moon
If they won't believe
So why do I go wrong
On repeat?
I was blinded by a memory
Like it's someone else, like it wasn't me
And there's every chance I'll be learnin' fast
And the day will come, and then it will pass
I taught you wrong
When I say I won't
And though I try, I do the same as though I must
And in the air of today is tomorrow's dust
There's no use trying to relate
To that older soul
And no use biding your time
If the bell has tolled
I was blinded by a memory
Like it's someone else, like it wasn't me
And there's every chance I'll be movin' fast
And the day will come, and then it will pass
Sympathy for the fauna
Fragile life in the sauna
In the sea getting warmer
Endlessly 'round the corner
And though I try, I do the same as though I must
And in the air of today is tomorrow's dust",The Slow Rush
47,On Track,"I close my front door
And turn on the light
I let out a breath
And hold in a sigh
Ain't nothing new
Ain't that much in sight
And if I'm counting days
Dream fruition ain't
What it's lookin' like.
But strictly speaking I'm still on track
Strictly speaking I'm holding on
More than a minor setback
But strictly speaking I'm still on track
And all of my dreams are still in sight
Cos strictly speaking I've got my whole life
I lost a wheel a while back
But strictly speaking I'm still on track
Challenges falling in my lap
Strung out again but still on track
I know it's unrealistic
Over-optimistic
I know I tried before this
I know it's nearly August
I know I can't ignore this
I'm looking forward to all this
Saying ""babe I just adore this""
And ""babe can we afford this?""
I know it's been a slow year
Nothing much to show here
I didn't really go for it
So not a lot to show for it
The hardest part is over
Adjusting makes it slower
So glad you're coming over
A wall to bring us closer
The world ain't rooting for ya
Nothing to lose it over
We're just a little older
The rest comes easy
But strictly speaking I'm still on track
Strictly speaking I'm holding back
Struggles keep falling in my lap
Yeah, but strictly speaking I'm still on track
So tell everyone I'll be alright
Cos strictly speaking I've got my whole life
More than one major setback
But strictly speaking I'm still on track
The hardest part is over
Adjusting makes it slower
So glad you're coming over
A wall to bring us closer
The world ain't rooting for ya
Nothing to lose it over
We're just a little older
The rest comes easy",The Slow Rush
48,Lost in Yesterday,"When we were living in squalor, wasn't it heaven
Back when we used to get on it four out of seven
Now even though that was a time I hated from day one
Eventually terrible memories turn into great ones
So if they call you, embrace them
If they hold you, erase them
Cause it might've been something, who's to say?
Does it help to get lost in yesterday?
And you might have missed something, don't say
Cause it hurts to be lost in yesterday
And you're gonna have to let it go someday
You've been digging it up like Groundhog Day
Cause it might've been something, don't say
Cause it hurts to be lost in yesterday
Matty said life didn't go the way that he planned it
Said ""oh what I'd give to start over, Boy I'd command it""
So what was I ever afraid of? Why did I worry?
Why was I ever so brainless? Head in a flurry
Cause if they call you, embrace them
If they stall you, erase them
Cause it might have been something, who's to say?
Does it help to get lost in yesterday?
And you might have missed something, don't say
Cause it hurts to get lost in yesterday
And you're gonna have to let it go someday
You've been digging it up like Groundhog Day
Cause it might have been something, don't say
Cause it hurts to stay lost in yesterday
If it calls you, embrace it
If it haunts you, face it
I know it's mad, I understand
It's all just snakes and ladders
The myriad, you never had
There's only one that matters
If it calls you, embrace it
If it holds you, erase it",The Slow Rush
49,Is It True,"We were hangin' in the morning
Feelin' all different kinds of things
We were talkin' about everything
From the past to the happenin'
We started talkin' 'bout devotion
The kind that goes on eternally
And I tell her I'm in love with her
But how can I know that I'll always be?
She just said, ""Is it true? Is it true? Tell me now""
It's a promise I can't make and I won't validate
Was I in some kind of mood? I don't know, I don't care
Now I'm sleepin' in my room, here I am, back again
She's in my
I was happy just listening
No intention to be mentioning
We started talkin' 'bout the future
'Bout the notion I was motioning
I'm just so terrified to face up
Like any moment I might wake up
'Cause she's the only thing I think of
I told my mother that I love her
She just said, ""Is it true? Is it true? Tell me now""
It's a promise I can't make and I won't validate
Was I being immature? I don't know, I don't care
Now I'm sleeping in my room, here I am, back again
She's in my
In my
I said, ""We'll see""
We'll see
In my
We'll see
Oh, we'll see
We'll see
We'll see, we'll see, we'll see
See how we go
Until we know what the future holds
Ah, we'll see
We'll see
We'll see, we'll see, we'll see",The Slow Rush
50,It Might Be Time,"Something doesn't feel right
That's enough for one night
Hope y'all get home alright
There I go, blamin' on the weather

But hey, there's nothin' wrong
I'm only tired of all these voices
Always sayin' nothing lasts forever

It might be time to face it
It ain't as fun as it used to be, no
You're goin' under
You ain't as young as you used to be
It might be time to face it
You ain't as cool as you used to be, no
You won't recover
You ain't as young as you used to be

It might be time to face it
It might be time to face it

[Verse 2]
I've been lost before
So tell me it's not over
'Cause I finally got somethin' goin'
And suddenly
All my friends are growin' up
And movin' on
I must be missin' somethin'
You might also like
One More Year
Tame Impala
Breathe Deeper
Tame Impala
New Person, Same Old Mistakes
Tame Impala

'Cause I just wanna keep this dream alive for now
Don't they know nothin' lasts forever?

It might be time to face it
Nobody knows what you've come here for, no
You're goin' under
They roll their eyes when you're at the door

It might be time
It might be time to face it (Yeah)
You may as well embrace it

[Bridge]
We promise to come visit (Yeah)
It might be time

It might be time to face it (Yeah)
You ain't as fun as you used to be
You won't recover
You ain't as cool as you used to be

It might be time to face it
It might be time to face it",The Slow Rush
51,Glimmer,"It's like, ""Oh, bass, cool""
You know how you make the bass better?
Crank the bass up (yeah)
You wanna make the kick drum better?
Just crank the bass up
And it's like, ""No, not really""
I just wanna let it go
I just wanna let it go
I just wanna let it go
I just wanna let it go
I just wanna let it go
I just wanna let it go",The Slow Rush
52,One More Hour,"Just a moment
Right before all the song and dance
Wasn't brave enough to tell you
But there ain't gonna be another chance
It's not long until
All that I have
And everything's still
The minutes are racin'
Whatever I've done
I did it for love
I did it for fun
Couldn't get enough
I did it for fame
But never for money
Not for houses
Not for her
Not for my future children
Until now
How could I love again?
How could I ever ask for more?
And to the road ahead
Into a life I can't ignore
how could I love again?
(Move on) how can I walk this path for sure?
(Lose her) with no more time to spend
(Move on) I know the answer more and more
As long as I can
Long as I can
Spend some time alone
As long as I can
Long as I can
Be the man I am
Oh, life is strange
For one more hour
I can rage
For one more hour
As long as I can (lose her)
As long as I can (move on)
Spend some time alone
As long as I can (lose her)
As long as I can (move on)
Remember who I am
As long as I can (lose her)
As long as I can (move on)
Spend some time alone
As long as I can
As long as I can (how could I love again?)
Be the man I am
Just a minute, fella, right before you go out there
All your voices said you wouldn't last a minute bare
One more hour and you'll know your life is one to share
Just a minute, baby, right before we go from here
All those people said we wouldn't last a minute near
I'm with you and I could roll into another year
Just a minute, fella, right before you go out there
All your voices said you wouldn't last a minute, bare
One more hour and you'll know your life is one to share
Just a minute, baby, right before we go from here
All those people said they wouldn't last a minute near
I'm with you and I could roll into another year
Just a minute fella right before you go out there",The Slow Rush
53,One Night/All Night,"Woman
'Cause if that's the only answer
Then we could be together
'Cause I wanna feel the pressure
And I could be your woman
'Cause if that's the only answer
Then we could be together
'Cause I wanna feel the pressure
And I could be your woman
'Cause if that's the only answer
Then we could be together
'Cause I wanna feel the pressure
And I could be your woman
'Cause if that's the only answеr
Then we could be togеther
'Cause I wanna feel the pressure
(And I could be your wo—)
Woman
'Cause if that's the only answer
Then we could be together
'Cause I wanna feel the pressure
And I could be your woman
'Cause if that's the only answer
Then we could be together
'Cause I wanna feel the pressure
And I could be your woman
'Cause if that's the only answer
Then we could be together
'Cause I wanna feel the pressure
(And I could be your woman)
One night
All night
One night
Going all night
We're goin' one night
Or all night
One night
Going all night
And I could be your woman
'Cause if that's the only answer
Then we could be together
'Cause I wanna feel the pressure
And I could be your woman
'Cause if that's the only answer
Then we could be together
'Cause I wanna feel the pressure",The Slow Rush
54,Journey To The Real World (From Barbie The Album),"Somewhere else there is to see
The future is a mystery
I wonder what we'll see
When we get to
The real world
We're going to
The real world
The real world",Journey To The Real World (From Barbie The Album)
55,Retina Show,"It's the retina show for your eye
It's the ego of instinctive desire
It's the reason that you make me break down and cry
It's the retina show for your eye
It's the ego of instinctive desire
It's the reason that you make me break down and cry
If you don't think it, then it won't show
And you believe it too
Baby, tonight, it's written all over you
Baby, tonight, it's written all over you
Make me, make me feel love
Make me, make me feel love
Make me, make me feel love
Make me, make me feel love
It's the retina show for your eye
It's the ego of instinctive desire
It's the reason that you make me break down and cry
If you don't think it, then it won't show
And you believe it too
Baby, tonight, it's written all over you
Baby, tonight, it's written all over you
It's the retina show for your eye
It's the ego of instinctive desire
It's the reason that you make me break down and cry
It's the retina show for your eye
It's the ego of instinctive desire
It's the reason that you make me break down and cry",Lonerism (20 Year Anniversary Edition / Unreleased Demos)
56,Sidetracked Soundtrack - Unreleased Demo,"Oh, my darling, why would you come back to me, baby?
I just don't know why
Already know I can't be alone
Don't know what some is
It's time to know, now just have to come and tell me
It could be the summer
It could be the summer
It could be the summer
It could be the summer",Lonerism (20 Year Anniversary Edition / Unreleased Demos)
